{
  "schema": "agent_atom_selection",
  "schema_version": "0.1",
  "identity_id": "lattice",
  "build_status": "candidate",
  "activation_semantics": "DEFINITION_ONLY",
  "composition_authority": "User-approved source-derived composition; no runtime activation.",
  "source_artifact": {
    "name": "IDENTITY_PROTOCOL_BACKEND_TWO_IDENTITIES_v1.1.1.zip",
    "version": "1.1.1",
    "sha256": "89d49088e4a97dc23e0ba535729154f586bc8c87dadb0e4c650ca022a7684a9c",
    "coverage": "SELECTED_RECORDS_ONLY",
    "completeness": "PARTIAL_SOURCE_PRESENT"
  },
  "catalogs": [
    {
      "path": "catalogs/lattice_desktop_atomic_catalog.json",
      "sha256": "967daee7dfbd2b5d8085c9184364dad0f14d7db2429e40d76c00f0ee0ea78c7c",
      "subject": "Lattice"
    },
    {
      "path": "catalogs/ipb_shared_control_atomic_catalog.json",
      "sha256": "1033e3642a6c0e169b938b81909c0cffbdaab426681892ecaa194b03fd5f66dd",
      "subject": "IPB Shared Control"
    }
  ],
  "selections": [
    {
      "target_pointer": "/control_protocol/action_state/0",
      "catalog": "catalogs/ipb_shared_control_atomic_catalog.json",
      "atom_id": "atom:bef361c43914ccd3bb1063e0",
      "source_file": "config/shared_protocol.json",
      "source_pointer": "/action_state/0",
      "canonical_value_sha256": "40ea7d4f4bb8ae18f3fb22b1bca60c9c8ccc62f1534114f29311573bed9cd762"
    },
    {
      "target_pointer": "/control_protocol/action_state/1",
      "catalog": "catalogs/ipb_shared_control_atomic_catalog.json",
      "atom_id": "atom:041c0e708ebef3fa3027d608",
      "source_file": "config/shared_protocol.json",
      "source_pointer": "/action_state/1",
      "canonical_value_sha256": "85d8d560b24134edb1c19c932d7e30f938a563559fafc4ea19f47aba519232a3"
    },
    {
      "target_pointer": "/control_protocol/action_state/2",
      "catalog": "catalogs/ipb_shared_control_atomic_catalog.json",
      "atom_id": "atom:84263afbc645c45c598db90b",
      "source_file": "config/shared_protocol.json",
      "source_pointer": "/action_state/2",
      "canonical_value_sha256": "f54361f68dfafbbf5619bcd355e803c2124e73937037c63c39d83ee6419bff67"
    },
    {
      "target_pointer": "/control_protocol/action_state/3",
      "catalog": "catalogs/ipb_shared_control_atomic_catalog.json",
      "atom_id": "atom:083d4be8127d5b72f71ba265",
      "source_file": "config/shared_protocol.json",
      "source_pointer": "/action_state/3",
      "canonical_value_sha256": "0b5e064c8b72fcf9e231828c9a5721d449e3f8d3b1787795bb7d517fb36217b8"
    },
    {
      "target_pointer": "/control_protocol/action_state/4",
      "catalog": "catalogs/ipb_shared_control_atomic_catalog.json",
      "atom_id": "atom:ba2291e4cdd4e4323cb2e603",
      "source_file": "config/shared_protocol.json",
      "source_pointer": "/action_state/4",
      "canonical_value_sha256": "7e8a57fe6936f927105769ecc492a139e1dd56a973b673a904b7a3a3fd41ee6a"
    },
    {
      "target_pointer": "/control_protocol/action_state/5",
      "catalog": "catalogs/ipb_shared_control_atomic_catalog.json",
      "atom_id": "atom:076e23bd08273e43836c9672",
      "source_file": "config/shared_protocol.json",
      "source_pointer": "/action_state/5",
      "canonical_value_sha256": "60425b9335f16734cd7ca9e65f364e2d70e4dff5c9ada6325e104e0e07874331"
    },
    {
      "target_pointer": "/control_protocol/action_state/6",
      "catalog": "catalogs/ipb_shared_control_atomic_catalog.json",
      "atom_id": "atom:96d6a370f804ff710886a301",
      "source_file": "config/shared_protocol.json",
      "source_pointer": "/action_state/6",
      "canonical_value_sha256": "0f15dc23249e5ae41849d7f070b24f8aea5d052fe3d20972b004e8b9e07349ba"
    },
    {
      "target_pointer": "/control_protocol/artifact_status/0",
      "catalog": "catalogs/ipb_shared_control_atomic_catalog.json",
      "atom_id": "atom:7b42c01d507d2b42063d2729",
      "source_file": "config/shared_protocol.json",
      "source_pointer": "/artifact_status/0",
      "canonical_value_sha256": "8949b4a16a0714fd9a240a8ed28d5cefa9157a5dc68af159359e66cd586bbf8d"
    },
    {
      "target_pointer": "/control_protocol/artifact_status/1",
      "catalog": "catalogs/ipb_shared_control_atomic_catalog.json",
      "atom_id": "atom:302024ae2bb80f28ead18a3e",
      "source_file": "config/shared_protocol.json",
      "source_pointer": "/artifact_status/1",
      "canonical_value_sha256": "8ac24611cfe47c129e37108bc6adc6843c4fe8fb9c37c27fac8a1835ba660307"
    },
    {
      "target_pointer": "/control_protocol/artifact_status/2",
      "catalog": "catalogs/ipb_shared_control_atomic_catalog.json",
      "atom_id": "atom:8c85dd55907bf7765ab7b10d",
      "source_file": "config/shared_protocol.json",
      "source_pointer": "/artifact_status/2",
      "canonical_value_sha256": "e9f69bb9e95e952aee0f44087595446891c645b7eaaaa25f08688125c242778d"
    },
    {
      "target_pointer": "/control_protocol/artifact_status/3",
      "catalog": "catalogs/ipb_shared_control_atomic_catalog.json",
      "atom_id": "atom:ba149bd1ac4364ad6bcd0f76",
      "source_file": "config/shared_protocol.json",
      "source_pointer": "/artifact_status/3",
      "canonical_value_sha256": "3d50e8dfbd6e9d98d503dbdd371f0896b67b6f98884de6b1bbc711bff2508994"
    },
    {
      "target_pointer": "/control_protocol/artifact_status/4",
      "catalog": "catalogs/ipb_shared_control_atomic_catalog.json",
      "atom_id": "atom:77ee7f22e95fc1790fe80db9",
      "source_file": "config/shared_protocol.json",
      "source_pointer": "/artifact_status/4",
      "canonical_value_sha256": "33d04bd775e7b6c6436742508b41fa693a15bd2c902fcd994253392abd717740"
    },
    {
      "target_pointer": "/control_protocol/artifact_status/5",
      "catalog": "catalogs/ipb_shared_control_atomic_catalog.json",
      "atom_id": "atom:0212ed86d4d7c01e1773b467",
      "source_file": "config/shared_protocol.json",
      "source_pointer": "/artifact_status/5",
      "canonical_value_sha256": "910626819e9812195810299d9cc9ee97656081d929feda68b53d4810c94ad01c"
    },
    {
      "target_pointer": "/control_protocol/compatibility/legacy_attestation_mapping/EXECUTED/dimension",
      "catalog": "catalogs/ipb_shared_control_atomic_catalog.json",
      "atom_id": "atom:d322eaff086746bd247b123d",
      "source_file": "config/shared_protocol.json",
      "source_pointer": "/compatibility/legacy_attestation_mapping/EXECUTED/dimension",
      "canonical_value_sha256": "6b6fdce2c6f9762666c2e6dd00b3a89831d3b2f9ec0bfa4054bf88fa9b45fad6"
    },
    {
      "target_pointer": "/control_protocol/compatibility/legacy_attestation_mapping/EXECUTED/value",
      "catalog": "catalogs/ipb_shared_control_atomic_catalog.json",
      "atom_id": "atom:15baf8074e2bf18c6fc62818",
      "source_file": "config/shared_protocol.json",
      "source_pointer": "/compatibility/legacy_attestation_mapping/EXECUTED/value",
      "canonical_value_sha256": "f54361f68dfafbbf5619bcd355e803c2124e73937037c63c39d83ee6419bff67"
    },
    {
      "target_pointer": "/control_protocol/compatibility/legacy_attestation_mapping/GENERATED/dimension",
      "catalog": "catalogs/ipb_shared_control_atomic_catalog.json",
      "atom_id": "atom:059f74a88e544235d879bcc7",
      "source_file": "config/shared_protocol.json",
      "source_pointer": "/compatibility/legacy_attestation_mapping/GENERATED/dimension",
      "canonical_value_sha256": "98ade16cf21887101748f3ac7ca453fc41e49eb6ae3a48cae91f1c225d4fc000"
    },
    {
      "target_pointer": "/control_protocol/compatibility/legacy_attestation_mapping/GENERATED/value",
      "catalog": "catalogs/ipb_shared_control_atomic_catalog.json",
      "atom_id": "atom:d15ea83eb4d42d61f4949647",
      "source_file": "config/shared_protocol.json",
      "source_pointer": "/compatibility/legacy_attestation_mapping/GENERATED/value",
      "canonical_value_sha256": "df3df625a93ee5dbf709ee40d2b09b65695a1a27f483f4ff0e3df0fcc6137ebf"
    },
    {
      "target_pointer": "/control_protocol/compatibility/legacy_attestation_mapping/INFERRED/dimension",
      "catalog": "catalogs/ipb_shared_control_atomic_catalog.json",
      "atom_id": "atom:36e5cc991b6c8ac5ada88705",
      "source_file": "config/shared_protocol.json",
      "source_pointer": "/compatibility/legacy_attestation_mapping/INFERRED/dimension",
      "canonical_value_sha256": "98ade16cf21887101748f3ac7ca453fc41e49eb6ae3a48cae91f1c225d4fc000"
    },
    {
      "target_pointer": "/control_protocol/compatibility/legacy_attestation_mapping/INFERRED/value",
      "catalog": "catalogs/ipb_shared_control_atomic_catalog.json",
      "atom_id": "atom:9deeeb76db1d814fa5dc249b",
      "source_file": "config/shared_protocol.json",
      "source_pointer": "/compatibility/legacy_attestation_mapping/INFERRED/value",
      "canonical_value_sha256": "a48cdfe57cd25913815777c718324a1baa18855067bfaa1d1dcd40228ea19bb7"
    },
    {
      "target_pointer": "/control_protocol/compatibility/legacy_attestation_mapping/OBSERVED/dimension",
      "catalog": "catalogs/ipb_shared_control_atomic_catalog.json",
      "atom_id": "atom:032ca41260e174dd484622a3",
      "source_file": "config/shared_protocol.json",
      "source_pointer": "/compatibility/legacy_attestation_mapping/OBSERVED/dimension",
      "canonical_value_sha256": "98ade16cf21887101748f3ac7ca453fc41e49eb6ae3a48cae91f1c225d4fc000"
    },
    {
      "target_pointer": "/control_protocol/compatibility/legacy_attestation_mapping/OBSERVED/value",
      "catalog": "catalogs/ipb_shared_control_atomic_catalog.json",
      "atom_id": "atom:2469f01266f121e9079ffe5a",
      "source_file": "config/shared_protocol.json",
      "source_pointer": "/compatibility/legacy_attestation_mapping/OBSERVED/value",
      "canonical_value_sha256": "827761a810e70fe2741d3562eb2ad45028f503e043d8cda7edf26a06d726b638"
    },
    {
      "target_pointer": "/control_protocol/compatibility/legacy_attestation_mapping/RETRIEVED/dimension",
      "catalog": "catalogs/ipb_shared_control_atomic_catalog.json",